"News#","Title Content","Matched Words","Score","Polarity"
"363","NOVAMIN IN PROPOSED BUYOUT BY BREAWATER BWRLF","","0","Neutral"
"364","LILLY INDUSTRIAL COATINGS INC LICIA 1ST QTR","","0","Neutral"
"365","COMMONWEALTY REALTY CRTYZ BAY BAY END TALKS","","0","Neutral"
"366","METPRO CORP MPR 4TH QTR ENDS JAN 31 NET","","0","Neutral"
"367","EDO EDO TO BUY BACK ADDITIONAL 500000 SHARES","","0","Neutral"
"368","VISTA VISA FORMS OFFICE OF THE PRESIDENT","","0","Neutral"
"369","CENTRAL MAINE POWER CO CTP SETS QUARTERLY","","0","Neutral"
"370","SOME FIRMS CURB COMMODITIES BUSINESS WITH DREXEL","","0","Neutral"
"371","PEP BOYS PBY SETS SPLIT RAISES QUARTERLY","split, pep","0","Neutral"
"372","PEP BOYS  MANNY MOE AND JACK INC PBY 4TH QTR","pep","1","Positive"
"373","HOVNANIAN ENTERPRISES HOV EARNINGS TO RISE","","0","Neutral"
"374","NY TRADERS SAY TURKEY MADE LARGE SUGAR PURCHASE","","0","Neutral"
"375","NORFOLK NSC UNIT SELLS EQUIPMENT CERTIFICATES","","0","Neutral"
"376","ANHEUSERBUSCH BUD OFFICER RESIGNS","","0","Neutral"
"377","JOHNSON SAYS FEDS ACTIONS YESTERDAY MEANT TO STABILIZE DOLLAR AT CURRENT LEVELS","stabilize","1","Positive"
"378","SUNSTAR FOODS INC SUNF 2ND QTR FEB 28 NET","","0","Neutral"
"379","PHOENIX RE PXRE INITIAL OFFERING UNDER WAY","","0","Neutral"
"380","NIPPON SIGNAL TO ISSUE 50 MLN SWISS FRANC NOTES","issue","-1","Negative"
"381","HADSON HADS TO ACQUIRE 85 PCT OF SEAXE SEAX","","0","Neutral"
"382","REUTERS TO BUY I P SHARP OF CANADA","sharp","1","Positive"
"383","TCBY ENTERPRISES TCBY SPLITS STOCK","","0","Neutral"
"384","FIRST INTERSTATE I SELLS CAPITAL NOTES","","0","Neutral"
"385","RAYTHEON CO RTN SETS QUARTERLY","","0","Neutral"
"386","FIAT MAY ISSUE BOND FOR LIBYAN STAKE PAPER SAYS","issue","-1","Negative"
"387","ITALYS STET FORMS TELECOMMUNICATIONS FIRM","","0","Neutral"
"388","PH GLATFELTER CO GLP INCREASES DIVIDEND","","0","Neutral"
"389","LIFE OF INDIANA CORP LIFI 4TH QTR LOSS","loss","-1","Negative"
"390","CORRECTED  TSENG TSNG SEES SALES INCREASE","","0","Neutral"
"391","BRAZILIAN BANK STRIKE SPREADS UNION SAYS","strike","-1","Negative"
"392","CONSOLIDATED NOREX TO ACQUIRE TRIWEB RESOURCES","","0","Neutral"
"393","THAI SUGAR PRODUCTION CONTINUES HIGH IN FEB","","0","Neutral"
"394","SWEDISH EXPORT CREDIT ISSUES NEW ZEALAND DLR BOND","issues","-1","Negative"
"395","APOLLO COMPUTER APCI IN JOINT MARKETING PACT","","0","Neutral"
"396","ACCUGRAPH IN ASIA MARKETING PACT WITH TRIOTECH","","0","Neutral"
"397","REICHHOLD CHEMICALS INC EXPLORING POSSIBLE SALE OF EUROPEAN SUBSIDIARY","","0","Neutral"
"398","NY TRADERS EXPECT CHINA TO STEP UP SUGAR BUYING","","0","Neutral"
"399","ROSS STORES INC ROST 4TH QTR JAN 31 LOSS","loss","-1","Negative"
"400","ITALIAN TREASURY BILL OFFER HAS MIXED RESPONSE","","0","Neutral"
"401","AFG AFG EXPANDS INTO AUTO GLASS REPLACEMENT","","0","Neutral"
"402","GREENWOOD RESOURCES SAYS BANKS COULD FORECLOSE","","0","Neutral"
"403","NAVISTAR NAV STILL EXPECTS HIGHER 1987 NET","","0","Neutral"
"404","HEES INTERNATIONAL SETS 100 MLN DLR SHARE ISSUE","issue","-1","Negative"
"405","CORRECTEDLILLY INDUSTRIAL COATINGS INC LICIA","","0","Neutral"
"406","US SENATE PANEL APPROVES TRADE MISSION BILL","","0","Neutral"
"407","CATERPILLAR CAT WORKERS TOLD TO END SITIN","","0","Neutral"
"408","BAT SHARES UNDERVALUED SAY STOCK MARKET ANALYSTS","","0","Neutral"
"409","BALDRIGE SAYS US WILL NOT LET JAPAN DOMINATE WORLD ELECTRONICS MARKET","dominate","1","Positive"
"410","REICHHOLD RCI EXPLORING SALE OF EUROPEAN UNIT","","0","Neutral"
"411","AMERICUS TRUST FOR MERCK MRK NOW EFFECTIVE","trust, effective","2","Positive"
"412","UAL SAID DONALD TRUMP WAS INTERESTED IN UAL STOCK AS INVESTMENT","trump","1","Positive"
"413","INTL BROADCASTING IBCA SETS REVERSE SPLIT","split","-1","Negative"
"414","BI INC BIAC SETS REVERSE SPLIT","split","-1","Negative"
"415","BALDRIGE SAYS JAPAN MUST OPEN ITS MARKETS","","0","Neutral"
"416","K MART KM UNIT BUYS TEXAS LAND","","0","Neutral"
"417","BASF CORP YEAR NET","","0","Neutral"
"418","TORONTO DOMINION BUYING MONTREAL EXCHANGE SEAT","","0","Neutral"
"419","LEAR SIEGLER DEPOSITS 794 MLN DLRS TO SECURE NOTES EFFECTS REORGANIZATION","secure","1","Positive"
"420","JAM JAMY WINS 15 MLN DLR CONTRACT","wins, jam","0","Neutral"
"421","UNISYS UIS NEW MAINFRAME INTRODUCTION NOT SET","","0","Neutral"
"422","MONTANA POWER CO MTP VOTES QUARTERLY DIVIDEND","","0","Neutral"
"423","UAL UAL SAID TRUMP TALKED WITH UAL CHAIRMAN","trump","1","Positive"
"424","GROLIER GLR DEBT UPGRADED BY MOODYS","upgraded, debt","0","Neutral"
"425","TEAM INC TMI 3RD QTR FEB 28 NET","","0","Neutral"
"426","TODD SHIPYARDS CORP OMITS QTLY COMMON DIV SETS PREFERRED PAYOUT","","0","Neutral"
"427","RSI CORP RSIC 2ND QTR FEB 28 NET","","0","Neutral"
"428","RCM TECHNOLOGIES INC RCMT 1ST QTR JAN 31 LOSS","loss","-1","Negative"
"429","MCCLAIN INDUSTRIES INC MCCL 1ST QTR DEC 31 NET","","0","Neutral"
"430","FED OFFERS TO BUY ONE BILLION DLRS OF BILLS FOR CUSTOMER AFTER NOTE AUCTION","","0","Neutral"
"431","SYNALLOY SYO ENDS PLANS TO SELL UNIT","","0","Neutral"
"432","CIL ACQUIRING TRIMACS STAKE IN TRICIL","","0","Neutral"
"433","EC INFLATION STARTS TO RISE AGAIN IN FEBRUARY","","0","Neutral"
"434","PANTERAS PANT TO BUY TEN PIZZA RESTAURANTS","","0","Neutral"
"435","ALLIEDSIGNAL INC TO SELL LINOTYPE GROUP TO COMMERZBANK OF WEST GERMANY","","0","Neutral"
"436","ENERGYUS OIL OUTPUT","","0","Neutral"
"437","TODD SHIPYARDS TOD OMITS COMMMON DIVIDEND","","0","Neutral"
"438","IMO DELAVAL IMD SETS INITIAL DIVIDEND","","0","Neutral"
"439","FED TO PURCHASE TREASURY BILLS FOR A CUSTOMER","","0","Neutral"
"440","GOULD GLD INTRODUCES NEW MINI SUPERCOMPUTERS","","0","Neutral"
"441","NATIONAL COMPUTER SYSTEMS INC NLCS4TH QTR NET","","0","Neutral"
"442","SEC SANCTIONS ACCOUNTANTS KMG MAIN HURDMAN","","0","Neutral"
"443","ALLIEDSIGNAL ALD TO SELL LINOTYPE UNIT","","0","Neutral"
"444","CONTINENTAL HEALTH AFFILIATES INC CTHL 4TH QTR","","0","Neutral"
"445","CANADA SETS OIL INDUSTRY AID PACKAGE","","0","Neutral"
"446","CONTINENTAL CTHL REPURCHASES NOTES","","0","Neutral"
"447","ATLANTIS GROUP INC TO OFFER SHARES NOTES","","0","Neutral"
"448","MOUNTLEIGH GROUP SEEKS 100 MLN STG FACILITY","","0","Neutral"
"449","SOUTHWEST FOREST SWF SETTLES STRIKE","strike","-1","Negative"
"450","COCOA TALKS SLOW AT CRUCIAL STAGE  DELEGATES","slow","-1","Negative"
"451","MACK TRUCKS MACK DEBT AFFIRMED BY SP","debt","-1","Negative"
"452","EURATOM ECU BOND MARKS ROME TREATY ANNIVERSARY","","0","Neutral"
"453","NEWMONT GOLD NGC SEES GOLD SALES RISING","gold","2","Positive"
"454","MESSIDOR TO MERGE WITH TRITON BELEGGINGEN","","0","Neutral"
"455","IMMUNOGENETICS IGEN TO ENTER LIPOSOME FIELD","","0","Neutral"
"456","SMITH BARNEY ANALYST CUTS HERCULES HPC RATING","","0","Neutral"
"457","SP UPGRADES CONSUMERS POWERS SENIOR AND SUBORDINATED DEBT","debt","-1","Negative"
"458","NAVISTAR NAV SEES HIGHER CAPITAL SPENDING","","0","Neutral"
"459","MOHAWK DATA MDS AFFILIATE IN SERVICE DEAL","","0","Neutral"
"460","CONSUMERS POWER CMS DEBT RAISED BY SP","debt","-1","Negative"
"461","ENCOR ENERGY CORP PLANS 125 MLN DLR DEBENTURE OFFER","","0","Neutral"
"462","PACIFIC GAS PCG SEEKS PURCHASE RULE CHANGE","","0","Neutral"
"463","ENCOR ENERGY CORP INC YR NET LOSS 4066 MLN VS PROFIT 354 MLN","loss","-1","Negative"
"464","BRAZIL PLANS NEW ECONOMIC STRATEGY FOR GROWTH","","0","Neutral"
"465","MIDDLE SOUTH MSU TO FORM NEW DIVIDEND POLICY","","0","Neutral"
"466","UK POLL SHOWS SURGE FOR CENTRIST ALLIANCE PARTIES","","0","Neutral"
"467","EMERSON RADIO EME SELLS DEBT PRIVATELY","debt","-1","Negative"
"468","SOLAR SYSTEMS SUN DANCE SSDN EXTENDS WARRANTS","","0","Neutral"
"469","TWA SOLD FOUR MLN SHARES OF USAIR BELIEVED TO INSTITUTIONS WALL STREET SOURCES","","0","Neutral"
"470","US SUGAR POLICY MAY SELFDESTRUCT CONGRESSMAN","","0","Neutral"
"471","FIAT SAYS IT NOT PLANNING TO ISSUE EUROBONDS","issue","-1","Negative"
"472","INVESTORS INCREASE STAKE IN FROST SULLIVAN","frost","-1","Negative"
"473","LIBERIAN ORE CARRIER IN COLLISION IN RIVER ELBE","","0","Neutral"
"474","AIM TELEPHONES AIMT SELLS DEBT TO SHAREHOLDER","debt","-1","Negative"
"475","HERSHEY OIL CORP HSO 4TH QTR LOSS","loss","-1","Negative"
"476","VISTA MANAGEMENT INC GETS BOND GUARANTEES","","0","Neutral"
"477","EG AND G INC EGG SETS QUARTERLY","","0","Neutral"
"478","ENCOR ENERGY CORP INC YEAR LOSS","loss","-1","Negative"
"479","BRAZILIAN LABOUR UNREST SPREADS MANY BANKS SHUT","unrest","-1","Negative"
"480","OAK INDUSTRIES OAK SETS DEBT EXCHANGE OFFER","debt","-1","Negative"
"481","COLLINS FOODS CF TO REDEEM DEBENTURES","redeem","1","Positive"
"482","ANDREOTTI DROPS COALITION BID","","0","Neutral"
"483","TEAM TMI TO UNVEIL NEW EQUIPMENT IN MAY","","0","Neutral"
"484","ASTA GROUP INC UNIT IN LOAN PURCHASE","","0","Neutral"
"485","ENCOR PLANS 125 MLN DLR DEBENTURE OFFERING","","0","Neutral"
"486","ARDEN INTERNATIONAL AIKI 4TH QTR DEC 27 NET","","0","Neutral"
"487","TWA TWA SELLS POSITION IN USAIR U","","0","Neutral"
"488","COMBUSTION ENGINEERINGCSP SEES 1ST QTR NET OFF","","0","Neutral"
"489","NEWMONT GOLD SEES ITS SALES RISING 22 PCT","gold","1","Positive"
"490","TALKING POINTTOBACCO STOCKS","","0","Neutral"
"491","null","","0","Neutral"
"492","MICRO DISPLAY MDSI GETS EUROPEAN ORDERS","","0","Neutral"
"493","TREASURYS BAKER SAYS EXCHANGE RATE CHANGES WILL REDUCE TRADE DEFICIT THIS YEAR","","0","Neutral"
"494","TREASURYS BAKER SAYS ECONOMIC COOPERATION PROCESS IS WORKING","","0","Neutral"
"495","TREASURYS BAKER SAYS THROWING MONEY AT DEBTOR NATIONS WONT WORK","work","1","Positive"
"496","UTAH POWER UTP PLANS TO REDEEM PREFERRED STOCK","redeem","1","Positive"
"497","GATEWAY SPORTING BUYS INNOVATIVE DENTAL","innovative","1","Positive"
"498","TREASURYS BAKER SEES CUT IN TRADE DEFICIT","","0","Neutral"
"499","CYCLOPS CORP REFORMS BOARD AFTER DIXONS GROUP FAILS TO GET MAJORITY OF CYCLOPS STOCK","reforms, fails","0","Neutral"
"500","UK TO RETAIN POWERS AGAINST US UNITARY TAXATION","","0","Neutral"
"501","TREASURYS BAKER SAYS ECONOMIC COOPERATION WORKS","works","1","Positive"
"502","PAN ATLANTIC RE INC PNRE 4TH QTR NET","pan","-1","Negative"
"503","QUAKER CHEMICAL CORP QCHM SETS QUARTERLY","","0","Neutral"
"504","RAYTHEON RTN DIRECTOR RESIGNS","","0","Neutral"
"505","MIDDLE SOUTH MSU TO CONSIDER DIVIDEND","","0","Neutral"
"506","MONARCH CAPITAL MON CALLS PREFERRED","","0","Neutral"
"507","CYANOTECH CYAN SETS WAY TO EXTRACT CAROTENE","","0","Neutral"
"508","SAS TO UPGRADE CABIN SERVICE IN SCANDINAVIA","","0","Neutral"
"509","BELGIUM PLANS TO OUTLAW INSIDER TRADING","outlaw","-1","Negative"
"510","OWENSCORNING FIBERGLAS OCF SELLS FOAM UNIT","","0","Neutral"
"511","US SHOE INC 4TH QTR SHR 31 CTS VS 56 CTS","","0","Neutral"
"512","US TAX FRAUD CHARGES BROUGHT AGAINST THREE","fraud","-1","Negative"
"513","OBRIEN ENERGY OBS IN CITICORP CCI LEASE","","0","Neutral"
"514","QUAKER CHEMICAL QCHM TO REPURCHASE SHARES","","0","Neutral"
"515","TREASURYS BAKER OUTLINES TRADE BILL CRITICISMS","criticisms","-1","Negative"
"516","null","","0","Neutral"
"517","CASINO COMMISSION DELAYS VOTE ON HOLIDAY HIA","delays","-1","Negative"
"518","WORTHERN BANKING WOR IN AGREEMENT WITH FEDS","","0","Neutral"
"519","US SHOE CORP USR 4TH QTR JAN 31 NET","","0","Neutral"
"520","NUTMEG INDUSTRIES NUTM SETS LICENSING PACT","","0","Neutral"
"521","ARGENTINE SOYBEAN YIELD ESTIMATES DOWN FURTHER","","0","Neutral"
"522","BETA PHASE BETA TO SELL EYEGLASS TECHNOLOGY","","0","Neutral"
"523","LYNG SAYS AGRICULTURE SHOULD SHARE SPENDING CUTS","","0","Neutral"
"524","TREASURYS BAKER SAYS NEW MONEY NOT PANACEA","","0","Neutral"
"525","VERTEX INDUSTRIES INC VETX 2ND QTR JAN 31 NET","","0","Neutral"
"526","CYCLOPS CYL SAYS DIXONS APPOINTEES RESIGN","","0","Neutral"
"527","ECUADOR NEGOTIATES WITH NIGERIA FOR LENDING OIL","","0","Neutral"
"528","COMPUTERVISION CVN UNVEILS NEW DESIGN GEAR","","0","Neutral"
"529","null","","0","Neutral"
"530","NORTHERN STATES POWER CO NSP VOTES QUARTERLY","","0","Neutral"
"531","SUMMIT TAX EXEMPT BOND FUND SUA SETS PAYOUT","","0","Neutral"
"532","US SENATE TRADE LEADER CONCERNED ABOUT CANADA","concerned","-1","Negative"
"533","TREASURYS BAKER SAYS NEW MONEY NOT DEBT PANACEA","debt","-1","Negative"
"534","BAKER SAYS US WILLING TO COOPERATE TO STABILIZE EXCHANGE RATES","willing, stabilize","2","Positive"
"535","BAKER SAYS US WANTS TO STABILIZE EXCHANGE RATES","stabilize","1","Positive"
"536","JUSTICE DOT BACK AIRLINE ANTITRUST SWITCH","","0","Neutral"
"537","US GOVERNMENT EXPANDS CRACKDOWN ON BAD DEBTS","debts, bad","-2","Negative"
"538","FIRST FEDERAL DELAWARE AGREEMENT EXTENDED","","0","Neutral"
"539","EDELMAN GROUP IN PLAN TO BUY MORSE SHOE MRS","","0","Neutral"
"540","PHILIP MORRIS MO OSCAR MAYER SETS REDEMPTION","redemption","1","Positive"
"541","US  AUTO AGENCY GRANTS FORD F AIR BAG REQUEST","","0","Neutral"
"542","MERCK MRK GETS FDA HEARTWORM MEDICINE APPROVAL","approval","1","Positive"
"543","JOHN LABATT SEES GOOD FOURTH QUARTER YEAR","good","1","Positive"
"544","HUSKY HYO SETS MEETING TO APPROVE MERGER","approve","1","Positive"
"545","BALTIMORE GAS AND ELECTRIC BGE FILES DEBT","debt","-1","Negative"
"546","MERCK MRK GETS APPROVAL FOR DOG HEART DRUG","approval","1","Positive"
"547","WASHINGTON GAS LIGHT CO WGL HIKES PAYOUT","","0","Neutral"
"548","ZENITH ZE NAMES NEW FINANCIAL OFFICER","zenith","1","Positive"
"549","FERC DECISION COULD CUT COLUMBIA GAS CG NET","","0","Neutral"
"550","US OFFERS MORE CREDITS FOR VEG OIL TO N YEMEN","","0","Neutral"
"551","PUERTO RICAN CEMENT CO PRN SETS PAYOUT","","0","Neutral"
"552","US SHOE USR TO OPEN 421 STORES IN 1987","","0","Neutral"
"553","BARRIS BRRS TO BUY BACK STOCK","","0","Neutral"
"554","CANADA MAY MONITOR STEEL SHIPMENTS","","0","Neutral"
"555","MEXICO SIGNS 100 MLN DLR IADB TOURISM LOAN","","0","Neutral"
"556","WESCO FINANCIAL CORP WSC 4TH QTR NET","","0","Neutral"
"557","HELM H SELLS ADDITIONAL SHARES IN BAMBERGER","","0","Neutral"
"558","AMPALAMERICAN ISRAEL CORP AISA YEAR NET","","0","Neutral"
"559","COCOA COUNCIL CHAIRMAN SEEKS BUFFER COMPROMISE","","0","Neutral"
"560","SNC GROUP EXPECTS HIGHER 1987 EARNINGS SALES","","0","Neutral"
"561","MINE SAFETY MNES SELLS SOUTH AFRICA UNIT","","0","Neutral"
"562","MEDAR INC MDXR 4TH QTR DEC 31 LOSS","loss","-1","Negative"
"563","MEDAR MDXR CHANGES FISCAL YEAR","","0","Neutral"
"564","EPSILON DATA EPSI GETS NEW CREDIT AGREEMENT","","0","Neutral"
"565","US SECURITIES INDUSTRY ASSN BACKS RESTRAINTS ON TAKEOVERS INSIDER TRADING","","0","Neutral"
"566","CHEMFIX TECHNOLOGIES INC CFIX 2ND QTR NET","","0","Neutral"
"567","ALABAMA UPGRADED IN BRUCELLOSIS PROGRAM","upgraded","1","Positive"
"568","HELM H AFFILIATE SELLS SYSTEM","","0","Neutral"
"569","FEDERAL PAPER FBO OFFERS PREFERENTIAL SHARES","","0","Neutral"
"570","ALLISCHALMERS AH SELLS SWISS UNIT","","0","Neutral"
"571","MONARCH CAPITAL MON PR WILL NOT RESUME TRADING","","0","Neutral"
"572","FLORIDA EMPLOYERS INSURANCE CO FLAE YEAR 1986","","0","Neutral"
"573","SHELL OIL GETS 1043 MLN DLR CONTRACT","","0","Neutral"
"574","US 4YEAR NOTE AVERAGE YIELD 679 PCT STOP 679 PCT AWARDED AT HIGH YIELD 95 PCT","awarded","1","Positive"
"575","DETROIT EDISON FILES SHELF REGISTRATION FOR ONE BILLION DLRS IN BONDS","","0","Neutral"
"576","NIKE INC NIKE 3RD QTR FEB 28 NET","","0","Neutral"
"577","ZENITH NATIONAL INSURANCE ZNAT QTLY DIVIDEND","zenith","1","Positive"
"578","REDKIN LABORATORIES INC RDKN QTLY DIVIDEND","","0","Neutral"
"579","INTL MINERALS IGL PLANS BIOTECHNOLOGY PROJECT","","0","Neutral"
"580","COOPERVISION INC EYE QTLY DIVIDEND","","0","Neutral"
"581","UAL UAL SURROUNDED BY TAKEOVER SPECULATION","","0","Neutral"
"582","US SECURITIES GROUP BACKS INSIDER RESTRAINTS","","0","Neutral"
"583","TEXACO TX RESERVES DOWN DESPITE LOWER OUTPUT","","0","Neutral"
"584","SIX REPORTED WOUNDED IN ECUADOR GENERAL STRIKE","strike","-1","Negative"
"585","INTL MINERALS PROJECT TO BOOST HOG LEAN WEIGHT","lean, boost","2","Positive"
"586","LOMAC TO PAY 17 MLN DLRS TO CLEAN SITE IN FIRST SUPERFUND2 SETTLEMENT","clean","1","Positive"
"587","PULITZER PUBLISHING CO PLTZC DECLARES QTLY DIV","","0","Neutral"
"588","FEDERAL CO FFF SETS REGULAR PAYOUT","","0","Neutral"
"589","TRANSCANADA PIPE TRP SETS SHARE REDEMPTION","redemption","1","Positive"
"590","SOUTHWESTERN BELL SBC SEES EARNINGS DILUTION","","0","Neutral"
"591","BOLIVIAN DEBT BUYBACK PLAN SAID GAINING GROUND","gaining, debt","0","Neutral"
"592","BRAZIL WANTS TO INCREASE STEEL EXPORTS TO US","","0","Neutral"
"593","XYLOGICS IN INITIAL PUBLIC OFFERING","","0","Neutral"
"594","DETROIT EDISON DTE REGISTERS BONDS","","0","Neutral"
"595","SP DOWNGRADES DANA CORPS 900 MLN DLRS OF DEBT","debt","-1","Negative"
"596","ANCHOR SAVINGS BANK OFFERING FULLY SUBSCRIBED","savings","1","Positive"
"597","LEAR SIEGLER HOLDING CORP PLANS TO DIVEST AEROSPACE SUBSIDIARY","","0","Neutral"
"598","VARITY CORP YEAR SHR LOSS 21 CTS VS LOSS 16 CTS","loss","-2","Negative"
"599","NORDSON NDSN SETS 3FOR2 SPLIT","split","-1","Negative"
"600","BALDRIGE SEES US TRADE DEFICIT STARTING TO DECLINE IN FEB OR MARCH DATA","decline","-1","Negative"
"601","SP MAY UPGRADE WAINOCO OIL WOL","","0","Neutral"
"602","US BUDGET DIRECTOR WARNS AGAINST TAX INCREASE","","0","Neutral"
"603","BALDRIGE SEES US TRADE GAP DROPPING SOON","","0","Neutral"
"604","NORMAL WORK RESUMES AT NEW ZEALAND PORTS","work","1","Positive"
"605","VARITY CORP VAT 4TH QTR JAN 31 LOSS","loss","-1","Negative"
"606","INDIANA FEDERAL IFSL 4TH QTR NET","","0","Neutral"
"607","LEARSIEGLER HOLDING TO DIVEST AEROSPACE UNIT","","0","Neutral"
"608","RUBBERMAID RBD COMPLETES ACQUISITIONS","","0","Neutral"
"609","KANSAS POWER AND LIGHT KAN CHAIRMAN LEAVING","","0","Neutral"
"610","CRYSTAL OIL CO COR 4TH QTR LOSS","loss","-1","Negative"
"611","CHEMFIX TECHNOLOGIES CFIX 2ND QTR FEB 28 NET","","0","Neutral"
"612","FEDERALMOGUL CORP FMO SETS REGULAR DIVIDEND","","0","Neutral"
"613","IOWA RESOURCES INC IOR DECLARES QTLY DIVIDEND","","0","Neutral"
"614","EIA SAYS DISTILLATE STOCKS OFF 32 MLN BBLS GASOLINE UP 22 MLN CRUDE UP 75 MLN","crude","-1","Negative"
"615","US HOME RESALES UP IN FEBRUARY REALTORS SAY","","0","Neutral"
"616","EL PASO ELECTRIC ELPA TO BUY BACK BONDS","","0","Neutral"
"617","LOWER US SOYBEAN LOAN IDEA SHARPLY CRITICIZED","sharply, criticized","-2","Negative"
"618","FIDUCIARY TRUST CO IN FIVEFORONE STOCK SPLIT","trust, split","0","Neutral"
"619","MODULAIRE MODX BUYS BOISE HOMES PROPERTY","","0","Neutral"
"620","US HOUSE PANEL ADOPTS BILL THAT COULD BAR JAPANESE PRIMARY DEALERS","","0","Neutral"
"621","LITTLE SUPPORT FOR MANDATORY ACREAGE CUTS  LYNG","support","1","Positive"
"622","UAL UAL UNIT LINKS RESERVATION SERVICE","","0","Neutral"
"623","DANA CORP DCN DEBT LOWERED BY SP","debt","-1","Negative"
"624","MINNESOTA POWER MPL SELLS SEVENYEAR BONDS","","0","Neutral"
"625","LA QUINTA MOTOR INNS INCLQM3RD QTR FEB 28 NET","","0","Neutral"
"626","KANSAS CITY SOUTHERN INDUSTRIES SAYS IT EAGER TO PURCHASE SOUTHERN PACIFIC RAILROAD","eager","1","Positive"
"627","FNMA ANNOUNCES 10 AND 20YEAR MORTGAGE PRODUCTS","","0","Neutral"
"628","US CHIPMAKERS URGE SANCTIONS AGAINST JAPAN","","0","Neutral"
"629","US LEGISLATION COULD BAR JAPANESE DEALERS","","0","Neutral"
"630","BOLIVIAN DEBT BUYBACK PLAN GAINS GROUND","debt, gains","0","Neutral"
"631","PDVSA PICKS ARCOAGIP CONSORTIUM IN COAL VENTURE","","0","Neutral"
"632","SP DOWNGRADES CHASE CHEMICAL IRVING MANUFACTURERS MELLON AND SECURITY PACIFIC","","0","Neutral"
"633","ICN ICN SAYS KODAK SALE WILL NOT AFFECT RD","","0","Neutral"
"634","RECENT US OIL DEMAND UP 01 PCT FROM YEAR AGO","","0","Neutral"
"635","FED APPROVES CHEMICAL BANK ACQUISITION OF TEXAS COMMERCE BANCSHARES","","0","Neutral"
"636","SP DOWNGRADES SIX US MONEY CENTER BANKS","","0","Neutral"
"637","KANSAS CITY KSU READY TO BUY SOUTHERN PACIFIC","ready","1","Positive"
"638","GENCORP GY BID COULD BE RAISED GROUP SAYS","","0","Neutral"
"639","UNOCAL UCL PLANS INCREASE IN CAPITAL SPENDING","","0","Neutral"
"640","FED APPROVES CHEMICAL NEW YORK CHL MERGER","","0","Neutral"
"641","VARITYVAT SEES IMPROVED RESULTS AFTER 1ST QTR","improved","1","Positive"
"642","CAMPBELL RESOURCES CCH UPS MESTON LAKE STAKE","","0","Neutral"
"643","FPL GROUP FPL UNIT FILES TO OFFER PREFERRED","","0","Neutral"
"644","METROBANC MTBC SHAREHOLDERS APPROVE MERGER","approve","1","Positive"
"645","CONNECTICUT ENERGY CNEUNIT SEEKS HIGHER RATES","","0","Neutral"
"646","CATTLEMEN ASSESSING DEATH LOSS FROM STORM","loss, death","-2","Negative"
"647","PLAINS RESOURCES INC PLNS YEAR LOSS","loss","-1","Negative"
"648","ECUADOR SIGNS 280 MLN DLR IADB LOAN","","0","Neutral"
"649","PERUS DEBT OBLIGATIONS HIT 63 BILLION DLRS IN 1987","debt","-1","Negative"
"650","PENNZOIL PZL WILLING TO SETTLE TEXACO TX LAWSUIT","willing","1","Positive"
"651","FARM CREDIT SYSTEM TO ASK FOR CONGRESSIONAL AID","","0","Neutral"
"652","GV MEDICAL INC GVMI 4TH QTR LOSS","loss","-1","Negative"
"653","FIRST FEDERALARKANSAS FARK IN COURT RULING","","0","Neutral"
"654","IBC PRESIDENT NOT TO ATTEND ICO EXECUTIVE BOARD","","0","Neutral"
"655","COLOMBIA TO MAINTAIN FOREIGN BORROWING LEVELS","","0","Neutral"
"656","EXCHANGE RATE BILL CLEARS US HOUSE PANEL","clears","1","Positive"
"657","US CHIPMAKERS URGE SANCTIONS AGAINST JAPAN","","0","Neutral"
"658","LOMAC TO PAY COSTS IN FIRST SUPERFUND AGREEMENT","","0","Neutral"
"659","WORLD BANK AFFILIATE PROVIDES CREDIT FOR HAITI","","0","Neutral"
"660","US AGRICULTURE SECY DOUBTFUL ON DEFICIT GOAL","doubtful","-1","Negative"
"661","CLABIR CLG AMBRIT ABI CALL OFF MERGER","","0","Neutral"
"662","FAA ORDERS VOICE RECORDERS ON NEW COMMUTER CRAFT","","0","Neutral"
"663","TELECOMMUNICATIONS BILL CLEARS US HOUSE PANEL","clears","1","Positive"
"664","BANK BOARD TAKES CONTROL OF FLORIDA THRIFT","thrift","1","Positive"
"665","MOODYS DOWNGRADES ZENITH ELECTRONICS ZE DEBT","zenith, debt","0","Neutral"
"666","SDC SYDNEY REPLACES CHAIRMAN","","0","Neutral"
"667","COST OF PIK CERTIFICATES TO BE EYED BY CONGRESS","","0","Neutral"
"668","DAILY TELEGRAPH IN DEAL WITH NEWS INTERNATIONAL","","0","Neutral"
"669","USACAFES USF UNIT POSTS RECORD WEEKLY SALES","","0","Neutral"
"670","MACAO TO KEEP EXISTING SYSTEM FOR 50 YEARS","","0","Neutral"
"671","FRIEDMAN INDUSTRIES INC FRD QUARTERLY DIV","","0","Neutral"
"672","CHIRAC SEES FASTER PRIVATISATION","faster","1","Positive"
"673","IADB MEETING ENDS WITH US ISOLATED ON REFORM","reform, isolated","0","Neutral"
"674","LATIN OIL PRODUCERS TO MEET IN CARACAS","","0","Neutral"
"675","AUSTRALIAN RESERVE BANK CUTS REDISCOUNT RATE","","0","Neutral"
"676","ARGENTINA SAYS COULD FOLLOW BRAZILIAN DEBT MOVE","debt","-1","Negative"
"677","GENOVA GNVA SIGNS DEFINITIVE MERGER AGREEMENT","","0","Neutral"
"678","PENOBSCOT SHOE CO PSO 1ST QTR FEB 27 NET","","0","Neutral"
"679","DREXEL SAYS BUSINESS STRONG DESPITE TRADE PROBE","strong","1","Positive"
"680","DAUSTER SAYS NO CHANGE IN BRAZILS COFFEE POLICY","","0","Neutral"
"681","EXCHANGE RATE BILL CLEARS US HOUSE PANEL","clears","1","Positive"
"682","CONSOLIDATE CAPITAL TRUST CIOTS 4TH QTR NET","trust","1","Positive"
"683","SARNEY REITERATES THAT BRAZIL WILL NOT GO TO IMF","","0","Neutral"
"684","US BANKS SEEN STEPPING UP SECURITIES ROLE","","0","Neutral"
"685","PALO VERDE UNIT 3 GRANTED OPERATING LICENSE","","0","Neutral"
"686","TREASURYS BAKER SAYS HE STANDS BY PARIS PACT TO FOSTER STABLE CURRENCIES","stable","1","Positive"
"687","MEMBERS VOTE TO DISSOLVE US FARM COOP","","0","Neutral"
"688","US SENATE FARM PANEL MAKEUP STILL IN DOUBT","doubt","-1","Negative"
"689","BAKER SAYS HE STANDS BY PARIS CURRENCY AGREEMENT","","0","Neutral"
"690","BAKER DECLINES COMMENT ON VOLCKER REAPPOINTMENT","declines","-1","Negative"
"691","CHINA SAYS 1986 BUDGET DEFICIT 708 BILLION YUAN","","0","Neutral"
"692","GUYANA FINANCE MINISTER OPTIMISTIC BUT SEEKS HELP","optimistic","1","Positive"
"693","BAKER OPPOSES STOCK TRANSACTION TAX PROPOSAL","","0","Neutral"
"694","BAKER SEEKS MORE BANK LOANS TO DEVELOPING NATIONS","","0","Neutral"
"695","LIBYANS APPEAR TO BE PULLING OUT OF CHAD","","0","Neutral"
"696","CHINA PORTUGAL INITIAL MACAO PACT","","0","Neutral"
"697","BAKER SEES 15 TO 20 BILLION DLR DROP IN TRADE GAP","","0","Neutral"
"698","Sumita says further yen rise would adversely affect Japanese economy","","0","Neutral"
"699","Sumita says major nations will continue to cooperate to stabilize currencies","stabilize","1","Positive"
"700","NZ MONEY SUPPLY RISES 24 PCT IN JANUARY","","0","Neutral"
"701","FURTHER YEN RISE WOULD HURT JAPAN ECONOMY SUMITA","hurt","-1","Negative"
"702","JAPAN VTR AND TV EXPORTS FALL IN FEBRUARY","fall","-1","Negative"
"703","DEMOCRAT LOSES BID TO WIN CONTRA AID ACCOUNTING","loses, win","0","Neutral"
"704","EC LINKS AGRICULTURAL TRADE TALKS TO OTHER REFORM","reform","1","Positive"
"705","VIETNAMS ARMY ORDERED TO GROW MORE FOOD","","0","Neutral"
"706","LINDE TURNOVER UP IN FIRST TWO MONTHS OF 1987","","0","Neutral"
"707","LINDE AG LINGF 1986 YEAR","","0","Neutral"
"708","PACIFIC DUNLOP ANNOUNCES AIDS PROTECTION DISCOVERY","protection","1","Positive"
"709","BANK OF NEW ZEALAND SHARES TO BE LISTED NEXT WEEK","","0","Neutral"
"710","JAPAN SEEN CUTTING APRIL BOND COUPON FROM FIVE PCT","","0","Neutral"
"711","SINGAPORE RULE CHANGES SEEN HAVING LITTLE IMPACT","","0","Neutral"
"712","TRADE SURPLUS CUT WOULD BENEFIT JAPAN  SUMITA","benefit","1","Positive"
"713","VIOLENCE REPORTED IN ECUADOR GENERAL STRIKE","strike","-1","Negative"
"714","PHILIPPINE DEBT TALKS PROCEED WITH NARROWER FOCUS","narrower, debt","-2","Negative"
"715","GARCIA SAYS PERU NOT TRYING TO EXPORT DEBT STANCE","debt","-1","Negative"
"716","SUPREME COURT UPHOLDS AFFIRMATIVE ACTION FOR WOMEN","supreme, affirmative","2","Positive"
"717","ECONOMIC SPOTLIGHT  HONG KONGS MORE ACTIVE ROLE","","0","Neutral"
"718","GULF ESCORTS STILL UNDER DISCUSSION  WEINBERGER","","0","Neutral"
"719","SRI LANKA TO LAUNCH APPEAL FOR DROUGHT AID","drought, appeal","0","Neutral"
"720","MIYAZAWA SAYS MAJOR NATIONS ACTING ON PARIS ACCORD","","0","Neutral"
